Nasdaq Traded|Symbol|Security Name|Listing Exchange|Market Category|ETF|Round Lot Size|Test Issue|Financial Status|CQS Symbol|NASDAQ Symbol|NextShares
Y|RDI|Reading International Inc - Class A Non-voting Common Stock|Q|S|N|100|N|N||RDI|N
Y|RDIB|Reading International Inc - Class B Voting Common Stock|Q|S|N|100|N|N||RDIB|N
Y|RDIV|Oppenheimer Ultra Dividend Revenue ETF|P| |Y|100|N||RDIV|RDIV|N
Y|RDN|Radian Group Inc. Common Stock|N| |N|100|N||RDN|RDN|N
Y|RDNT|RadNet, Inc. - Common Stock|Q|G|N|100|N|N||RDNT|N
Y|RDS.A|Royal Dutch Shell PLC Royal Dutch Shell American Depositary Shares (Each representing two Class A Ordinary Shares)|N| |N|100|N||RDS/A|RDS.A|N
Y|RDS.B|Royal Dutch Shell PLC Royal Dutch Shell PLC American Depositary Shares (Each representing two Class B Ordinary Shares)|N| |N|100|N||RDS/B|RDS.B|N
Y|RDUS|Radius Health, Inc. - Common Stock|Q|G|N|100|N|N||RDUS|N
Y|RDVY|First Trust Rising Dividend Achievers ETF|Q|G|Y|100|N|N||RDVY|N
Y|RDWR|Radware Ltd. - Ordinary Shares|Q|Q|N|100|N|N||RDWR|N
Y|RDY|Dr. Reddy's Laboratories Ltd Common Stock|N| |N|100|N||RDY|RDY|N
Y|RE|Everest Re Group, Ltd. Common Stock|N| |N|100|N||RE|RE|N
Y|RECN|Resources Connection, Inc. - Common Stock|Q|Q|N|100|N|N||RECN|N
Y|REED|Reeds, Inc. Common Stock|A| |N|100|N||REED|REED|N
Y|REET|iShares Trust iShares Global REIT ETF|P| |Y|100|N||REET|REET|N
Y|REFR|Research Frontiers Incorporated - Common Stock|Q|S|N|100|N|N||REFR|N
Y|REG|Regency Centers Corporation Common Stock|N| |N|100|N||REG|REG|N
Y|REG$G|Regency Centers Corporation Pfd Ser 7%|N| |N|100|N||REGpG|REG-G|N
Y|REGI|Renewable Energy Group, Inc. - Common Stock|Q|Q|N|100|N|N||REGI|N
Y|REGL|ProShares S&P MidCap 400 Dividend Aristocrats ETF|Z| |Y|100|N||REGL|REGL|N
Y|REGN|Regeneron Pharmaceuticals, Inc. - Common Stock|Q|Q|N|100|N|N||REGN|N
Y|REI|Ring Energy, Inc. Common Stock|A| |N|100|N||REI|REI|N
Y|REIS|Reis, Inc - Common Stock|Q|Q|N|100|N|N||REIS|N
Y|REK|ProShares Short Real Estate|P| |Y|100|N||REK|REK|N
Y|RELL|Richardson Electronics, Ltd. - Common Stock|Q|Q|N|100|N|N||RELL|N
Y|RELV|Reliv' International, Inc. - Common Stock|Q|S|N|100|N|N||RELV|N
Y|RELX|RELX PLC PLC American Depositary Shares (Each representing One Ordinary Share)|N| |N|100|N||RELX|RELX|N
Y|RELY|Real Industry, Inc.  - Common Stock|Q|Q|N|100|N|N||RELY|N
Y|REM|iShares Mortgage Real Estate Capped ETF|P| |Y|100|N||REM|REM|N
Y|REML|Credit Suisse AG Credit Suisse X-Links Monthly Pay 2xLeveraged Mortgage REIT Exchange Traded Notes (ETNs) due July 11, 2036|P| |N|100|N||REML|REML|N
Y|REMX|VanEck Vectors Rare Earth Strategic Metals ETF|P| |Y|100|N||REMX|REMX|N
Y|REN|Resolute Energy Corporation Comon Stock|N| |N|100|N||REN|REN|N
Y|RENN|Renren Inc. American Depositary Shares, each representing fifteen Class A ordinary shares|N| |N|100|N||RENN|RENN|N
Y|RENX|RELX N.V. American Depositary Shares (Each representing One Ordinary Share)|N| |N|100|N||RENX|RENX|N
Y|REPH|Recro Pharma, Inc. - Common Stock|Q|S|N|100|N|N||REPH|N
Y|RES|RPC, Inc. Common Stock|N| |N|100|N||RES|RES|N
Y|RESI|Altisource Residential Corporation Common Stock|N| |N|100|N||RESI|RESI|N
Y|RESN|Resonant Inc. - Common Stock|Q|S|N|100|N|N||RESN|N
Y|RETA|Reata Pharmaceuticals, Inc. - Class A Common Stock|Q|G|N|100|N|N||RETA|N
Y|RETL|Direxion Daily Retail Bull 3X Shares ETF|P| |Y|100|N||RETL|RETL|N
Y|REV|Revlon, Inc. New Common Stock|N| |N|100|N||REV|REV|N
Y|REVG|REV Group, Inc. Common Stock|N| |N|100|N||REVG|REVG|N
Y|REW|ProShares UltraShort Technology|P| |Y|100|N||REW|REW|N
Y|REX|REX American Resources Corporation|N| |N|100|N||REX|REX|N
Y|REXR|Rexford Industrial Realty, Inc. Common Stock|N| |N|100|N||REXR|REXR|N
Y|REXR$A|Rexford Industrial Realty, Inc. 5.875% Series A Cumulative Redeemable Preferred Stock|N| |N|100|N||REXRpA|REXR-A|N
Y|REXX|Rex Energy Corporation - Common Stock|Q|S|N|100|N|N||REXX|N
Y|REZ|iShares Residential Real Estate Capped ETF|P| |Y|100|N||REZ|REZ|N
Y|RF|Regions Financial Corporation Common Stock|N| |N|100|N||RF|RF|N
Y|RF$A|Regions Financial Corporation Depositary Shares Representing 1/40th Perpetual Preferred Series A|N| |N|100|N||RFpA|RF-A|N
Y|RF$B|Regions Financial Corporation Depositary Shares Representing 1/40th Perpetual Preferred Series B|N| |N|100|N||RFpB|RF-B|N
Y|RFAP|First Trust RiverFront Dynamic Asia Pacific ETF|Q|G|Y|100|N|N||RFAP|N
Y|RFCI|RiverFront Dynamic Core Income ETF|P| |Y|100|N||RFCI|RFCI|N
Y|RFDA|RiverFront Dynamic US Dividend Advantage ETF|P| |Y|100|N||RFDA|RFDA|N
Y|RFDI|First Trust RiverFront Dynamic Developed International ETF|Q|G|Y|100|N|N||RFDI|N
Y|RFEM|First Trust RiverFront Dynamic Emerging Markets ETF|Q|G|Y|100|N|N||RFEM|N
Y|RFEU|First Trust RiverFront Dynamic Europe ETF|Q|G|Y|100|N|N||RFEU|N
Y|RFFC|RiverFront Dynamic US Flex-Cap ETF|P| |Y|100|N||RFFC|RFFC|N
Y|RFG|Guggenheim S&P Midcap 400 Pure Growth ETF|P| |Y|100|N||RFG|RFG|N
Y|RFI|Cohen & Steers Total Return Realty Fund, Inc. Common Stock|N| |N|100|N||RFI|RFI|N
Y|RFIL|RF Industries, Ltd. - Common Stock|Q|G|N|100|N|N||RFIL|N
Y|RFP|Resolute Forest Products Inc. Common Stock|N| |N|100|N||RFP|RFP|N
Y|RFT|RAIT Financial Trust 7.625% Senior Notes due 2024|N| |N|100|N||RFT|RFT|N
Y|RFTA|RAIT Financial Trust 7.125% Senior Notes due 2019|N| |N|100|N||RFTA|RFTA|N
Y|RFUN|RiverFront Dynamic Unconstrained Income ETF|P| |Y|100|N||RFUN|RFUN|N
Y|RFV|Guggenheim S&P Midcap 400 Pure Value ETF|P| |Y|100|N||RFV|RFV|N
Y|RGA|Reinsurance Group of America, Incorporated Common Stock|N| |N|100|N||RGA|RGA|N
Y|RGC|Regal Entertainment Group Class A Common Stock|N| |N|100|N||RGC|RGC|N
Y|RGCO|RGC Resources Inc. - Common Stock|Q|G|N|100|N|N||RGCO|N
Y|RGEN|Repligen Corporation - Common Stock|Q|Q|N|100|N|N||RGEN|N
Y|RGI|Guggenheim S&P 500 Equal Weight Industrials ETF|P| |Y|100|N||RGI|RGI|N
Y|RGLD|Royal Gold, Inc. - Common Stock|Q|Q|N|100|N|N||RGLD|N
Y|RGLS|Regulus Therapeutics Inc. - Common Stock|Q|G|N|100|N|N||RGLS|N
Y|RGNX|REGENXBIO Inc. - Common Stock|Q|Q|N|100|N|N||RGNX|N
Y|RGR|Sturm, Ruger & Company, Inc. Common Stock|N| |N|100|N||RGR|RGR|N
Y|RGS|Regis Corporation Common Stock|N| |N|100|N||RGS|RGS|N
Y|RGSE|Real Goods Solar, Inc. - Class A Common Stock|Q|S|N|100|N|D||RGSE|N
Y|RGT|Royce Global Value Trust, Inc. Common Stock|N| |N|100|N||RGT|RGT|N
Y|RH|RH Common Stock|N| |N|100|N||RH|RH|N
Y|RHI|Robert Half International Inc. Common Stock|N| |N|100|N||RHI|RHI|N
Y|RHP|Ryman Hospitality Properties, Inc. (REIT)|N| |N|100|N||RHP|RHP|N
Y|RHS|Guggenheim S&P 500 Equal Weight Consumer Staples ETF|P| |Y|100|N||RHS|RHS|N
Y|RHT|Red Hat, Inc. Common Stock|N| |N|100|N||RHT|RHT|N
Y|RIBT|RiceBran Technologies - Common Stock|Q|S|N|100|N|D||RIBT|N
Y|RIBTW|RiceBran Technologies - Warrant|Q|S|N|100|N|N||RIBTW|N
Y|RIC|Richmont Mines, Inc. Common Stock|N| |N|100|N||RIC|RIC|N
Y|RICE|Rice Energy Inc. Common Stock|N| |N|100|N||RICE|RICE|N
Y|RICK|RCI Hospitality Holdings, Inc. - Common Stock|Q|G|N|100|N|N||RICK|N
Y|RIF|RMR Real Estate Income Fund (MD) Common Stock|A| |N|100|N||RIF|RIF|N
Y|RIG|Transocean Ltd (Switzerland) Common Stock|N| |N|100|N||RIG|RIG|N
Y|RIGL|Rigel Pharmaceuticals, Inc. - Common Stock|Q|Q|N|100|N|N||RIGL|N
Y|RIGS|RiverFront Strategic Income Fund|P| |Y|100|N||RIGS|RIGS|N
Y|RILY|B. Riley Financial, Inc. - Common Stock|Q|G|N|100|N|N||RILY|N
Y|RILYL|B. Riley Financial, Inc. - 7.50% Senior Notes|Q|G|N|100|N|N||RILYL|N
Y|RILYZ|B. Riley Financial, Inc. - 7.50% Senior Notes Due 2027|Q|G|N|100|N|N||RILYZ|N
Y|RINF|ProShares Inflation Expectations ETF|P| |Y|100|N||RINF|RINF|N
Y|RING|iShares MSCI Global Gold Miners Fund|P| |Y|100|N||RING|RING|N
Y|RIO|Rio Tinto Plc Common Stock|N| |N|100|N||RIO|RIO|N
Y|RISE|Sit Rising Rate ETF|P| |Y|100|N||RISE|RISE|N
Y|RIV|RiverNorth Opportunities Fund, Inc. Common Stock|N| |N|100|N||RIV|RIV|N
Y|RJA|AB Svensk Ekportkredit (Swedish Export Credit Corporation) ELEMENTS Linked to the Rogers International Commodity Index - Agriculture Total Return Structured Product|P| |N|100|N||RJA|RJA|N
Y|RJF|Raymond James Financial, Inc. Common Stock|N| |N|100|N||RJF|RJF|N
Y|RJI|AB Svensk Ekportkredit (Swedish Export Credit Corporation) ELEMENTS Linked to the Rogers International Commodity Index - Total Return Structured Product|P| |N|100|N||RJI|RJI|N
Y|RJN|AB Svensk Ekportkredit (Swedish Export Credit Corporation) ELEMENTS Linked to the Rogers International Commodity Index - Energy Total Return Structured Product|P| |N|100|N||RJN|RJN|N
Y|RJZ|AB Svensk Ekportkredit (Swedish Export Credit Corporation) ELEMENTS Linked to the Rogers International Commodity Index - Metals Total Return Structured Product|P| |N|100|N||RJZ|RJZ|N
Y|RKDA|Arcadia Biosciences, Inc. - Common Stock|Q|G|N|100|N|D||RKDA|N
Y|RL|Ralph Lauren Corporation Common Stock|N| |N|100|N||RL|RL|N
Y|RLGT|Radiant Logistics, Inc. Common Stock|A| |N|100|N||RLGT|RLGT|N
Y|RLGT$A|Radiant Logistics, Inc. 9.75% Series A Cumulative Redeemable Perpetual Preferred Stock|A| |N|100|N||RLGTpA|RLGT-A|N
Y|RLGY|Realogy Holdings Corp. Common Stock|N| |N|100|N||RLGY|RLGY|N
Y|RLH|Red Lions Hotels Corporation Common Stock|N| |N|100|N||RLH|RLH|N
Y|RLI|RLI Corp. Common Stock|N| |N|100|N||RLI|RLI|N
Y|RLJ|RLJ Lodging Trust Common Shares of Beneficial Interest $0.01 par value|N| |N|100|N||RLJ|RLJ|N
Y|RLJE|RLJ Entertainment, Inc. - Common Stock|Q|S|N|100|N|N||RLJE|N
Y|RLOG|Rand Logistics, Inc. - Common Stock|Q|S|N|100|N|D||RLOG|N
Y|RLY|SPDR SSgA Multi Asset Real Return ETF|P| |Y|100|N||RLY|RLY|N
Y|RM|Regional Management Corp. Common Stock|N| |N|100|N||RM|RM|N
Y|RMAX|RE/MAX Holdings, Inc. Class A Common Stock|N| |N|100|N||RMAX|RMAX|N
Y|RMBS|Rambus, Inc. - Common Stock|Q|Q|N|100|N|N||RMBS|N
Y|RMCF|Rocky Mountain Chocolate Factory, Inc. - Common Stock|Q|G|N|100|N|N||RMCF|N
Y|RMD|ResMed Inc. Common Stock|N| |N|100|N||RMD|RMD|N
Y|RMGN|RMG Networks Holding Corporation - Common Stock|Q|S|N|100|N|D||RMGN|N
Y|RMP|Rice Midstream Partners LP Common Units representing limited partner interests|N| |N|100|N||RMP|RMP|N
Y|RMR|The RMR Group Inc. - Class A Common Stock|Q|S|N|100|N|N||RMR|N
Y|RMT|Royce Micro-Cap Trust, Inc. Common Stock|N| |N|100|N||RMT|RMT|N
Y|RMTI|Rockwell Medical, Inc. - Common Stock|Q|G|N|100|N|N||RMTI|N
Y|RNDB|Randolph Bancorp, Inc. - Common Stock|Q|G|N|100|N|N||RNDB|N
Y|RNET|RigNet, Inc. - Common Stock|Q|Q|N|100|N|N||RNET|N
Y|RNG|Ringcentral, Inc. Class A Common Stock|N| |N|100|N||RNG|RNG|N
Y|RNN|Rexahn Pharmaceuticals, Inc. Common Stock|A| |N|100|N||RNN|RNN|N
Y|RNP|Cohen & Steers Reit and Preferred Income Fund Inc Common Shares|N| |N|100|N||RNP|RNP|N
Y|RNR|RenaissanceRe Holdings Ltd. Common Stock|N| |N|100|N||RNR|RNR|N
Y|RNR$C|RenaissanceRe Holdings Ltd. 6.08% Series C Preference Shares|N| |N|100|N||RNRpC|RNR-C|N
Y|RNR$E|RenaissanceRe Holdings Ltd. 5.375% Series E Preference Shares|N| |N|100|N||RNRpE|RNR-E|N
Y|RNST|Renasant Corporation - Common Stock|Q|Q|N|100|N|N||RNST|N
Y|RNVA|Rennova Health, Inc. - Common Stock|Q|S|N|100|N|D||RNVA|N
Y|RNVAZ|Rennova Health, Inc. - Warrant|Q|S|N|100|N|D||RNVAZ|N
Y|RNWK|RealNetworks, Inc. - Common Stock|Q|Q|N|100|N|N||RNWK|N
Y|ROAM|Hartford Multifactor Emerging Markets ETF|P| |Y|100|N||ROAM|ROAM|N
Y|ROBO|ROBO Global Robotics and Automation Index ETF|Q|G|Y|100|N|N||ROBO|N
Y|ROCK|Gibraltar Industries, Inc. - Common Stock|Q|Q|N|100|N|N||ROCK|N
Y|RODI|Barclays Return on Disability ETN|P| |N|100|N||RODI|RODI|N
Y|RODM|Hartford Multifactor Developed Markets (ex-US) ETF|P| |Y|100|N||RODM|RODM|N
Y|ROG|Rogers Corporation Common Stock|N| |N|100|N||ROG|ROG|N
Y|ROGS|Hartford Multifactor Global Small Cap ETF|P| |Y|100|N||ROGS|ROGS|N
Y|ROIC|Retail Opportunity Investments Corp. - Common Stock|Q|Q|N|100|N|N||ROIC|N
Y|ROK|Rockwell Automation, Inc. Common Stock|N| |N|100|N||ROK|ROK|N
Y|ROKA|Roka Bioscience, Inc. - Common Stock|Q|G|N|100|N|N||ROKA|N
Y|ROL|Rollins, Inc. Common Stock|N| |N|100|N||ROL|ROL|N
Y|ROLA|iPath Long Extended Russell 1000 TR Index ETN|P| |N|100|N||ROLA|ROLA|N
Y|ROLL|RBC Bearings Incorporated - Common Stock|Q|Q|N|100|N|N||ROLL|N
Y|ROM|ProShares Ultra Technology|P| |Y|100|N||ROM|ROM|N
Y|ROOF|IQ US Real Estate Small Cap ETF|P| |Y|100|N||ROOF|ROOF|N
Y|ROP|Roper Technologies, Inc. Common Stock|N| |N|100|N||ROP|ROP|N
Y|RORE|Hartford Multifactor REIT ETF|P| |Y|100|N||RORE|RORE|N
Y|ROSE|Rosehill Resources Inc. - Class A Common Stock|Q|S|N|100|N|N||ROSE|N
Y|ROSEU|Rosehill Resources Inc. - Unit|Q|S|N|100|N|N||ROSEU|N
Y|ROSEW|Rosehill Resources Inc. - Warrants|Q|S|N|100|N|N||ROSEW|N
Y|ROSG|Rosetta Genomics Ltd. - Ordinary Shares|Q|S|N|100|N|N||ROSG|N
Y|ROST|Ross Stores, Inc. - Common Stock|Q|Q|N|100|N|N||ROST|N
Y|ROUS|Hartford Multifactor U.S. Equity ETF|P| |Y|100|N||ROUS|ROUS|N
Y|ROX|Castle Brands, Inc. Castle Brands, Inc. Common Stock|A| |N|100|N||ROX|ROX|N
Y|ROYT|Pacific Coast Oil Trust Units of Beneficial Interest|N| |N|100|N||ROYT|ROYT|N
Y|RP|RealPage, Inc. - Common Stock|Q|Q|N|100|N|N||RP|N
Y|RPAI|Retail Properties of America, Inc. Class A Common Stock|N| |N|100|N||RPAI|RPAI|N
Y|RPAI$A|Retail Properties of America, Inc. Pfd Ser A %|N| |N|100|N||RPAIpA|RPAI-A|N
Y|RPD|Rapid7, Inc. - Common Stock|Q|G|N|100|N|N||RPD|N
Y|RPG|Guggenheim S&P 500 Pure Growth ETF|P| |Y|100|N||RPG|RPG|N
Y|RPM|RPM International Inc. Common Stock|N| |N|100|N||RPM|RPM|N
Y|RPRX|Repros Therapeutics Inc. - Common Stock|Q|S|N|100|N|D||RPRX|N
Y|RPT|Ramco-Gershenson Properties Trust Common Stock|N| |N|100|N||RPT|RPT|N
Y|RPT$D|Ramco-Gershenson Properties Trust 7.25% PERP PFD CONV SHS BEN INT SER D|N| |N|100|N||RPTpD|RPT-D|N
Y|RPV|Guggenheim S&P 500 Pure Value ETF|P| |Y|100|N||RPV|RPV|N
Y|RPXC|RPX Corporation - Common Stock|Q|Q|N|100|N|N||RPXC|N
Y|RQI|Cohen & Steers Quality Income Realty Fund Inc Common Shares|N| |N|100|N||RQI|RQI|N
Y|RRC|Range Resources Corporation Common Stock|N| |N|100|N||RRC|RRC|N
Y|RRD|R.R. Donnelley & Sons Company Common Stock|N| |N|100|N||RRD|RRD|N
Y|RRF|WisdomTree Global Real Return Fund|P| |Y|100|N||RRF|RRF|N
Y|RRGB|Red Robin Gourmet Burgers, Inc. - Common Stock|Q|Q|N|100|N|N||RRGB|N
Y|RRR|Red Rock Resorts, Inc. - Class A Common Stock|Q|Q|N|100|N|N||RRR|N
Y|RRTS|Roadrunner Transportation Systems, Inc Common Stock|N| |N|100|N||RRTS|RRTS|N
Y|RS|Reliance Steel & Aluminum Co. Common Stock (DE)|N| |N|100|N||RS|RS|N
Y|RSG|Republic Services, Inc. Common Stock|N| |N|100|N||RSG|RSG|N
Y|RSO|Resource Capital Corp. Resource Capital Corp. Common Stock|N| |N|100|N||RSO|RSO|N
Y|RSO$A|Resource Capital Corp. 8.50% Series A Cumulative Redeemable Preferred Stock|N| |N|100|N||RSOpA|RSO-A|N
Y|RSO$B|Resource Capital Corp. Pfd Ser B|N| |N|100|N||RSOpB|RSO-B|N
Y|RSO$C|Resource Capital Corp. Preferred Series C|N| |N|100|N||RSOpC|RSO-C|N
Y|RSP|Guggenheim S&P 500 Equal Weight ETF|P| |Y|100|N||RSP|RSP|N
Y|RSPP|RSP Permian, Inc. Common Stock|N| |N|100|N||RSPP|RSPP|N
Y|RST|Rosetta Stone Rosetta Stone, Inc.|N| |N|100|N||RST|RST|N
Y|RSX|VanEck Vectors Russia ETF|P| |Y|100|N||RSX|RSX|N
Y|RSXJ|VanEck Vectors Russia Small-Cap ETF|P| |Y|100|N||RSXJ|RSXJ|N
Y|RSYS|RadiSys Corporation - Common Stock|Q|Q|N|100|N|N||RSYS|N
Y|RT|Ruby Tuesday, Inc. Common Stock|N| |N|100|N||RT|RT|N
Y|RTEC|Rudolph Technologies, Inc. Common Stock|N| |N|100|N||RTEC|RTEC|N
Y|RTH|VanEck Vectors Retail ETF|P| |Y|100|N||RTH|RTH|N
Y|RTIX|RTI Surgical, Inc. - Common Stock|Q|Q|N|100|N|N||RTIX|N
Y|RTK|Rentech, Inc. - Common Stock|Q|S|N|100|N|D||RTK|N
Y|RTLA|iPath Long Extended Russell 2000 TR Index ETN|P| |N|100|N||RTLA|RTLA|N
Y|RTM|Guggenheim S&P 500 Equal Weight Materials ETF|P| |Y|100|N||RTM|RTM|N
Y|RTN|Raytheon Company Common Stock|N| |N|100|N||RTN|RTN|N
Y|RTNB|root9B Holdings, Inc.  - Common Stock|Q|S|N|100|N|E||RTNB|N
Y|RTRX|Retrophin, Inc. - Common Stock|Q|G|N|100|N|N||RTRX|N
Y|RTTR|Ritter Pharmaceuticals, Inc. - Common Stock|Q|S|N|100|N|D||RTTR|N
Y|RUBI|The Rubicon Project, Inc. Common Stock|N| |N|100|N||RUBI|RUBI|N
Y|RUN|Sunrun Inc. - Common Stock|Q|Q|N|100|N|N||RUN|N
Y|RUSHA|Rush Enterprises, Inc. - Class A Common Stock|Q|Q|N|100|N|N||RUSHA|N
Y|RUSHB|Rush Enterprises, Inc. - Class B Common Stock|Q|Q|N|100|N|N||RUSHB|N
Y|RUSL|Direxion Daily Russia Bull 3x Shares|P| |Y|100|N||RUSL|RUSL|N
Y|RUSS|Direxion Daily Russia Bear 3x Shares|P| |Y|100|N||RUSS|RUSS|N
Y|RUTH|Ruth's Hospitality Group, Inc. - Common Stock|Q|Q|N|100|N|N||RUTH|N
Y|RVEN|Reven Housing REIT, Inc. - Common Stock|Q|S|N|100|N|N||RVEN|N
Y|RVLT|Revolution Lighting Technologies, Inc. - Common Stock|Q|S|N|100|N|N||RVLT|N
Y|RVNC|Revance Therapeutics, Inc. - Common Stock|Q|G|N|100|N|N||RVNC|N
Y|RVNU|Deutsche X-Trackers Municipal Infrastructure Revenue Bond ETF|P| |Y|100|N||RVNU|RVNU|N
Y|RVP|Retractable Technologies, Inc. Common Stock|A| |N|100|N||RVP|RVP|N
Y|RVSB|Riverview Bancorp Inc - Common Stock|Q|Q|N|100|N|N||RVSB|N
Y|RVT|Royce Value Trust, Inc. Common Stock|N| |N|100|N||RVT|RVT|N
Y|RWC|RELM Wireless Corporation Common Stock|A| |N|100|N||RWC|RWC|N
Y|RWJ|Oppenheimer Small Cap Revenue ETF|P| |Y|100|N||RWJ|RWJ|N
Y|RWK|Oppenheimer Mid Cap Revenue ETF|P| |Y|100|N||RWK|RWK|N
Y|RWL|Oppenheimer Large Cap Revenue ETF|P| |Y|100|N||RWL|RWL|N
Y|RWLK|ReWalk Robotics Ltd - Ordinary Shares|Q|S|N|100|N|N||RWLK|N
Y|RWM|ProShares Short Russell2000|P| |Y|100|N||RWM|RWM|N
Y|RWO|SPDR DJ Wilshire Global Real Estate ETF|P| |Y|100|N||RWO|RWO|N
Y|RWR|SPDR DJ Wilshire REIT ETF|P| |Y|100|N||RWR|RWR|N
Y|RWT|Redwood Trust, Inc. Common Stock|N| |N|100|N||RWT|RWT|N
Y|RWW|Oppenheimer Financials Sector Revenue ETF|P| |Y|100|N||RWW|RWW|N
Y|RWX|SPDR DJ Wilshire Intl Real Estate|P| |Y|100|N||RWX|RWX|N
Y|RXD|ProShares UltraShort Health Care|P| |Y|100|N||RXD|RXD|N
Y|RXDX|Ignyta, Inc. - Common Stock|Q|S|N|100|N|N||RXDX|N
Y|RXI|iShares Global Consumer Discretionary ETF|P| |Y|100|N||RXI|RXI|N
Y|RXII|RXi Pharmaceuticals Corporation - Common Stock|Q|S|N|100|N|D||RXII|N
Y|RXIIW|RXi Pharmaceuticals Corporation - Warrants|Q|S|N|100|N|N||RXIIW|N
Y|RXL|ProShares Ultra Health Care|P| |Y|100|N||RXL|RXL|N
Y|RXN|Rexnord Corporation Common Stock|N| |N|100|N||RXN|RXN|N
Y|RXN$A|Rexnord Corporation Depositary Shares, each representing a 1/20th interest in a share of 5.75% Series A Mandatory Convertible Preferred Stock|N| |N|100|N||RXNpA|RXN-A|N
Y|RY|Royal Bank Of Canada Common Stock|N| |N|100|N||RY|RY|N
Y|RY$S|Royal Bank Of Canada 5.50% Non-Cumulative Perpetual First Preferred Shares, Series C-1|N| |N|100|N||RYpS|RY-S|N
Y|RY$T|Royal Bank Of Canada 6.750% Fixed Rate/Floating Rate Noncumulative First Preferred Shares, Series C-2|N| |N|100|N||RYpT|RY-T|N
Y|RYAAY|Ryanair Holdings plc - American Depositary Shares, each representing five Ordinary Shares|Q|Q|N|100|N|N||RYAAY|N
Y|RYAM|Rayonier Advanced Materials Inc. Common Stock|N| |N|100|N||RYAM|RYAM|N
Y|RYAM$A|Rayonier Advanced Materials Inc. 8.00% Series A Mandatory Convertible Preferred Stock|N| |N|100|N||RYAMpA|RYAM-A|N
Y|RYE|Guggenheim S&P 500 Equal Weight Energy ETF|P| |Y|100|N||RYE|RYE|N
Y|RYF|Guggenheim S&P 500 Equal Weight Financials ETF|P| |Y|100|N||RYF|RYF|N
Y|RYH|Guggenheim S&P 500 Equal Weight Healthcare ETF|P| |Y|100|N||RYH|RYH|N
Y|RYI|Ryerson Holding Corporation Common Stock|N| |N|100|N||RYI|RYI|N
Y|RYJ|Guggenheim Raymond James SB-1 Equity Fund|P| |Y|100|N||RYJ|RYJ|N
Y|RYN|Rayonier Inc. REIT Common Stock|N| |N|100|N||RYN|RYN|N
Y|RYT|Guggenheim S&P 500 Equal Weight Technology ETF|P| |Y|100|N||RYT|RYT|N
Y|RYU|Guggenheim S&P 500 Equal Weight Utilities ETF|P| |Y|100|N||RYU|RYU|N
Y|RZA|Reinsurance Group of America, Incorporated 6.20% Fixed-to-Floating Rate Subordinated Debentures due 2042|N| |N|100|N||RZA|RZA|N
Y|RZB|Reinsurance Group of America, Incorporated 5.75% Fixed-To-Floating Rate Subordinated Debentures due 2056|N| |N|100|N||RZB|RZB|N
Y|RZG|Guggenheim S&P Smallcap 600 Pure Growth ETF|P| |Y|100|N||RZG|RZG|N
Y|RZV|Guggenheim S&P Smallcap 600 Pure Value ETF|P| |Y|100|N||RZV|RZV|N
Y|S|Sprint Corporation Common Stock|N| |N|100|N||S|S|N
Y|SA|Seabridge Gold, Inc. Ordinary Shares (Canada)|N| |N|100|N||SA|SA|N
Y|SAA|ProShares Ultra SmallCap600|P| |Y|100|N||SAA|SAA|N
Y|SAB|Saratoga Investment Corp 6.75% Notes due 2023|N| |N|100|N||SAB|SAB|N
Y|SABR|Sabre Corporation - Common Stock|Q|Q|N|100|N|N||SABR|N
Y|SACH|Sachem Capital Corp. Common Shares|A| |N|100|N||SACH|SACH|N
Y|SAEX|SAExploration Holdings, Inc. - Common Stock|Q|G|N|100|N|N||SAEX|N
Y|SAFM|Sanderson Farms, Inc. - Common Stock|Q|Q|N|100|N|N||SAFM|N
Y|SAFT|Safety Insurance Group, Inc. - Common Stock|Q|Q|N|100|N|N||SAFT|N
Y|SAGE|Sage Therapeutics, Inc. - Common Stock|Q|G|N|100|N|N||SAGE|N
Y|SAGG|Direxion Daily Total Bond Market Bear 1X Shares|P| |Y|100|N||SAGG|SAGG|N
Y|SAH|Sonic Automotive, Inc. Common Stock|N| |N|100|N||SAH|SAH|N
Y|SAIA|Saia, Inc. - Common Stock|Q|Q|N|100|N|N||SAIA|N
Y|SAIC|SCIENCE APPLICATIONS INTERNATIONAL CORPORATION Common Stock|N| |N|100|N||SAIC|SAIC|N
Y|SAJA|Sajan, Inc. - Common Stock|Q|S|N|100|N|N||SAJA|N
Y|SAL|Salisbury Bancorp, Inc. - Common Stock|Q|S|N|100|N|N||SAL|N
Y|SALM|Salem Media Group, Inc. - Class A Common Stock|Q|G|N|100|N|N||SALM|N
Y|SALT|Scorpio Bulkers Inc. Common Stock|N| |N|100|N||SALT|SALT|N
Y|SAM|Boston Beer Company, Inc. (The) Common Stock|N| |N|100|N||SAM|SAM|N
Y|SAMG|Silvercrest Asset Management Group Inc. - Common Stock|Q|G|N|100|N|N||SAMG|N
Y|SAN|Banco Santander, S.A. Sponsored ADR (Spain)|N| |N|100|N||SAN|SAN|N
Y|SAN$A|Banco Santander, S.A. 6.80% Non-cumulative Series 4 Guaranteed Preferred Securities|N| |N|100|N||SANpA|SAN-A|N
Y|SAN$B|Santander Finance Preferred SA Unipersonal Floating Rate Non-cumulative Series 6 Guaranteed Preferred Securities|N| |N|100|N||SANpB|SAN-B|N
Y|SAN$C|Banco Santander, S.A. 6.50% Non-Cumulative Series 5 Guaranteed Preferred Securities|N| |N|100|N||SANpC|SAN-C|N
Y|SAN$I|Banco Santander Central Hispano, S.A. Santander Finance Preferred S.A. Unipersonal 6.41% Non-Cumulative Guaranteed Preferred Securities, Series 1|N| |N|100|N||SANpI|SAN-I|N
Y|SAND|Sandstorm Gold Ltd. Ordinary Shares (Canada)|A| |N|100|N||SAND|SAND|N
Y|SANM|Sanmina Corporation - Common Stock|Q|Q|N|100|N|N||SANM|N
Y|SANW|S&W Seed Company - Common Stock|Q|S|N|100|N|N||SANW|N
Y|SAP|SAP  SE ADS|N| |N|100|N||SAP|SAP|N
Y|SAR|Saratoga Investment Corp New|N| |N|100|N||SAR|SAR|N
Y|SASR|Sandy Spring Bancorp, Inc. - Common Stock|Q|Q|N|100|N|N||SASR|N
Y|SATS|EchoStar Corporation - common stock|Q|Q|N|100|N|N||SATS|N
Y|SAUC|Diversified Restaurant Holdings, Inc. - Common Stock|Q|S|N|100|N|N||SAUC|N
Y|SAVE|Spirit Airlines, Inc. - Common Stock|Q|Q|N|100|N|N||SAVE|N
Y|SB|Safe Bulkers, Inc Common Stock ($0.001 par value)|N| |N|100|N||SB|SB|N
Y|SB$B|Safe Bulkers, Inc 8.00% Series B Cumulative Redeemable Perpetual Preferred Shares|N| |N|100|N||SBpB|SB-B|N
Y|SB$C|Safe Bulkers, Inc Cumulative Redeemable Perpetual Preferred Series C (Marshall Islands)|N| |N|100|N||SBpC|SB-C|N
Y|SB$D|Safe Bulkers, Inc Perpetual Preferred Series D (Marshall Islands)|N| |N|100|N||SBpD|SB-D|N
Y|SBAC|SBA Communications Corporation - Class A Common Stock|Q|Q|N|100|N|N||SBAC|N
Y|SBB|ProShares Short SmallCap600|P| |Y|100|N||SBB|SBB|N
Y|SBBC|Scorpio Tankers Inc. 8.25% Senior Notes due 2019|N| |N|100|N||SBBC|SBBC|N
Y|SBBP|Strongbridge Biopharma plc - Ordinary Shares|Q|Q|N|100|N|N||SBBP|N
Y|SBBX|Sussex Bancorp - Common Stock|Q|G|N|100|N|N||SBBX|N
Y|SBCF|Seacoast Banking Corporation of Florida - Common Stock|Q|Q|N|100|N|N||SBCF|N
Y|SBCP|Sunshine Bancorp, Inc. - Common Stock|Q|S|N|100|N|N||SBCP|N
Y|SBFG|SB Financial Group, Inc. - Common Stock|Q|S|N|100|N|N||SBFG|N
Y|SBFGP|SB Financial Group, Inc. - Depositary Shares each representing a 1/100th interest in a 6.50% Noncumulative convertible perpetual preferred share, Series A|Q|S|N|100|N|N||SBFGP|N
Y|SBGI|Sinclair Broadcast Group, Inc. - Class A Common Stock|Q|Q|N|100|N|N||SBGI|N
Y|SBGL|Sibanye Gold Limited American Depositary Shares (Each representing four ordinary shares)|N| |N|100|N||SBGL|SBGL|N
Y|SBH|Sally Beauty Holdings, Inc. (Name to be changed from Sally Holdings, Inc.) Common Stock|N| |N|100|N||SBH|SBH|N
Y|SBI|Western Asset Intermediate Muni Fund Inc Common Stock|A| |N|100|N||SBI|SBI|N
Y|SBIO|ALPS Medical Breakthroughs ETF|P| |Y|100|N||SBIO|SBIO|N
Y|SBLK|Star Bulk Carriers Corp. - Common Shares|Q|Q|N|100|N|N||SBLK|N
Y|SBLKL|Star Bulk Carriers Corp. - 8.00% Senior Notes Due 2019|Q|Q|N|100|N|N||SBLKL|N
Y|SBM|Short Basic Materials|P| |Y|100|N||SBM|SBM|N
Y|SBNA|Scorpio Tankers Inc. 6.75% Senior Notes due 2020|N| |N|100|N||SBNA|SBNA|N
Y|SBNB|Scorpio Tankers Inc. 7.50% Senior Notes Due 2017|N| |N|100|N||SBNB|SBNB|N
Y|SBNY|Signature Bank - Common Stock|Q|Q|N|100|N|N||SBNY|N
Y|SBNYW|Signature Bank - Warrants 12/12/2018|Q|Q|N|100|N|N||SBNYW|N
Y|SBOT|Stellar Biotechnologies, Inc. - Common Stock|Q|S|N|100|N|N||SBOT|N
Y|SBOW|SilverBow Resorces, Inc. Common Stock|N| |N|100|N||SBOW|SBOW|N
Y|SBPH|Spring Bank Pharmaceuticals, Inc. - Common Stock|Q|S|N|100|N|N||SBPH|N
Y|SBR|Sabine Royalty Trust Common Stock|N| |N|100|N||SBR|SBR|N
Y|SBRA|Sabra Healthcare REIT, Inc. - Common Stock|Q|Q|N|100|N|N||SBRA|N
Y|SBRAP|Sabra Healthcare REIT, Inc. - 7.125% Preferred Series A (United States)|Q|Q|N|100|N|N||SBRAP|N
Y|SBS|Companhia de saneamento Basico Do Estado De Sao Paulo - Sabesp American Depositary Shares (Each repstg 250 Common Shares)|N| |N|100|N||SBS|SBS|N
Y|SBSI|Southside Bancshares, Inc. - Common Stock|Q|Q|N|100|N|N||SBSI|N
Y|SBUX|Starbucks Corporation - Common Stock|Q|Q|N|100|N|N||SBUX|N
Y|SBV|iPath Pure Beta Broad Commodity ETN|P| |N|100|N||SBV|SBV|N
Y|SC|Santander Consumer USA Holdings Inc. Common Stock|N| |N|100|N||SC|SC|N
Y|SCAC|Saban Capital Acquisition Corp. - Class A Ordinary Share|Q|S|N|100|N|N||SCAC|N
Y|SCACU|Saban Capital Acquisition Corp. - Unit|Q|S|N|100|N|N||SCACU|N
Y|SCACW|Saban Capital Acquisition Corp. - Warrants|Q|S|N|100|N|N||SCACW|N
Y|SCAP|AdvisorShares Cornerstone Small Cap ETF|P| |Y|100|N||SCAP|SCAP|N
Y|SCC|ProShares UltraShort Consumer Services|P| |Y|100|N||SCC|SCC|N
Y|SCCO|Southern Copper Corporation Common Stock|N| |N|100|N||SCCO|SCCO|N
Y|SCD|LMP Capital and Income Fund Inc. Common Stock|N| |N|100|N||SCD|SCD|N
