Nasdaq Traded|Symbol|Security Name|Listing Exchange|Market Category|ETF|Round Lot Size|Test Issue|Financial Status|CQS Symbol|NASDAQ Symbol|NextShares
Y|INR|Market Vectors Indian Rupee/USD  ETN|P| |N|100|N||INR|INR|N
Y|INS|Intelligent Systems Corporation Common Stock|A| |N|100|N||INS|INS|N
Y|INSE|Inspired Entertainment, Inc. - Common Stock|Q|S|N|100|N|D||INSE|N
Y|INSG|Inseego Corp. - Common Stock|Q|Q|N|100|N|N||INSG|N
Y|INSI|Insight Select Income Fund|N| |N|100|N||INSI|INSI|N
Y|INSM|Insmed, Inc. - Common Stock|Q|Q|N|100|N|N||INSM|N
Y|INST|Instructure, Inc. Common Stock|N| |N|100|N||INST|INST|N
Y|INSW|International Seaways, Inc. Common Stock |N| |N|100|N||INSW|INSW|N
Y|INSY|Insys Therapeutics, Inc. - Common Stock|Q|G|N|100|N|N||INSY|N
Y|INT|World Fuel Services Corporation Common Stock|N| |N|100|N||INT|INT|N
Y|INTC|Intel Corporation - Common Stock|Q|Q|N|100|N|N||INTC|N
Y|INTF|iShares Edge MSCI Multifactor Intl ETF|P| |Y|100|N||INTF|INTF|N
Y|INTG|The Intergroup Corporation - Common Stock|Q|S|N|100|N|N||INTG|N
Y|INTL|INTL FCStone Inc. - Common Stock|Q|Q|N|100|N|N||INTL|N
Y|INTT|inTest Corporation Common Stock|A| |N|100|N||INTT|INTT|N
Y|INTU|Intuit Inc. - Common Stock|Q|Q|N|100|N|N||INTU|N
Y|INTX|Intersections, Inc. - Common Stock|Q|G|N|100|N|N||INTX|N
Y|INUV|Inuvo, Inc.|A| |N|100|N||INUV|INUV|N
Y|INVA|Innoviva, Inc. - Common Stock|Q|Q|N|100|N|N||INVA|N
Y|INVE|Identiv, Inc. - Common Stock|Q|S|N|100|N|N||INVE|N
Y|INVH|Invitation Homes Inc. Common Stock|N| |N|100|N||INVH|INVH|N
Y|INWK|InnerWorkings, Inc. - Common Stock|Q|Q|N|100|N|N||INWK|N
Y|INXN|InterXion Holding N.V. Ordinary Shares (0.01 nominal value)|N| |N|100|N||INXN|INXN|N
Y|INXX|Columbia India Infrastructure ETF|P| |Y|100|N||INXX|INXX|N
Y|IO|Ion Geophysical Corporation Common Stock|N| |N|100|N||IO|IO|N
Y|IOIL|IQ Global Oil Small Cap ETF|P| |Y|100|N||IOIL|IOIL|N
Y|IONS|Ionis Pharmaceuticals, Inc. - Common Stock|Q|Q|N|100|N|N||IONS|N
Y|IOO|iShares Global 100 ETF|P| |Y|100|N||IOO|IOO|N
Y|IOSP|Innospec Inc. - Common Stock|Q|Q|N|100|N|N||IOSP|N
Y|IOT|Income Opportunity Realty Investors, Inc. Common Stock|A| |N|100|N||IOT|IOT|N
Y|IOTS|Adesto Technologies Corporation - Common Stock|Q|S|N|100|N|N||IOTS|N
Y|IP|International Paper Company Common Stock|N| |N|100|N||IP|IP|N
Y|IPAC|iShares Core MSCI Pacific ETF|P| |Y|100|N||IPAC|IPAC|N
Y|IPAR|Inter Parfums, Inc. - Common Stock|Q|Q|N|100|N|N||IPAR|N
Y|IPAS|iPass Inc. - Common Stock|Q|Q|N|100|N|N||IPAS|N
Y|IPAY|PureFunds ISE Mobile Payments ETF|P| |Y|100|N||IPAY|IPAY|N
Y|IPB|Merrill Lynch & Co., Inc. 6.0518% Index Plus Trust Certificates Series 2003-1|A| |N|100|N||IPB|IPB|N
Y|IPCC|Infinity Property and Casualty Corporation - Common Stock|Q|Q|N|100|N|N||IPCC|N
Y|IPCI|Intellipharmaceutics International Inc. - Common Stock|Q|S|N|100|N|N||IPCI|N
Y|IPD|SPDR S&P International Consumer Discretionary Sector ETF|P| |Y|100|N||IPD|IPD|N
Y|IPDN|Professional Diversity Network, Inc. - Common Stock|Q|S|N|100|N|N||IPDN|N
Y|IPE|SPDR Bloomberg Barclays TIPS ETF|P| |Y|100|N||IPE|IPE|N
Y|IPF|SPDR S&P International Financial Sector ETF|P| |Y|100|N||IPF|IPF|N
Y|IPFF|iShares International Preferred Stock ETF|P| |Y|100|N||IPFF|IPFF|N
Y|IPG|Interpublic Group of Companies, Inc. (The) Common Stock|N| |N|100|N||IPG|IPG|N
Y|IPGP|IPG Photonics Corporation - Common Stock|Q|Q|N|100|N|N||IPGP|N
Y|IPHI|Inphi Corporation Common Stock $0.001 par value|N| |N|100|N||IPHI|IPHI|N
Y|IPHS|Innophos Holdings, Inc. - Common Stock|Q|Q|N|100|N|N||IPHS|N
Y|IPI|Intrepid Potash, Inc Common Stock|N| |N|100|N||IPI|IPI|N
Y|IPK|SPDR S&P International Technology Sector ETF|P| |Y|100|N||IPK|IPK|N
Y|IPKW|PowerShares International BuyBack Achievers Portfolio|Q|G|Y|100|N|N||IPKW|N
Y|IPL$D|Interstate Power & Light Company Perp Prd Ser D|N| |N|100|N||IPLpD|IPL-D|N
Y|IPN|SPDR S&P International Industrial Sector ETF|P| |Y|100|N||IPN|IPN|N
Y|IPO|Renaissance IPO ETF|P| |Y|100|N||IPO|IPO|N
Y|IPOS|Renaissance Capital Greenwich Fund|P| |Y|100|N||IPOS|IPOS|N
Y|IPS|SPDR S&P International Consumer Staples Sector ETF|P| |Y|100|N||IPS|IPS|N
Y|IPU|SPDR S&P International Utilities Sector ETF|P| |Y|100|N||IPU|IPU|N
Y|IPW|SPDR S&P International Energy Sector ETF|P| |Y|100|N||IPW|IPW|N
Y|IPWR|Ideal Power Inc. - Common Stock|Q|S|N|100|N|N||IPWR|N
Y|IPXL|Impax Laboratories, Inc. - Common Stock|Q|Q|N|100|N|N||IPXL|N
Y|IQDE|FlexShares International Quality Dividend Defensive Index Fund|P| |Y|100|N||IQDE|IQDE|N
Y|IQDF|FlexShares International Quality Dividend Index Fund|P| |Y|100|N||IQDF|IQDF|N
Y|IQDG|WisdomTree International Quality Dividend Growth Fund|Z| |Y|100|N||IQDG|IQDG|N
Y|IQDY|FlexShares International Quality Dividend Dynamic Index Fund|P| |Y|100|N||IQDY|IQDY|N
Y|IQI|Invesco Quality Municipal Income Trust Common Stock|N| |N|100|N||IQI|IQI|N
Y|IQLT|iShares Edge MSCI Intl Quality Factor ETF|P| |Y|100|N||IQLT|IQLT|N
Y|IR|Ingersoll-Rand plc (Ireland)|N| |N|100|N||IR|IR|N
Y|IRBT|iRobot Corporation - Common Stock|Q|Q|N|100|N|N||IRBT|N
Y|IRCP|IRSA Propiedades Comerciales S.A. - American Depository Shares|Q|Q|N|100|N|N||IRCP|N
Y|IRDM|Iridium Communications Inc - Common Stock|Q|Q|N|100|N|N||IRDM|N
Y|IRDMB|Iridium Communications Inc - 6.75% Series B Cumulative Perpetual Convertible Preferred Stock|Q|Q|N|100|N|N||IRDMB|N
Y|IRET|Investors Real Estate Trust Shares of Beneficial Interest|N| |N|100|N||IRET|IRET|N
Y|IRET$B|Investors Real Estate Trust 7.95% Series B Cumulative Redeemable Preferred Shares|N| |N|100|N||IRETpB|IRET-B|N
Y|IRIX|IRIDEX Corporation - Common Stock|Q|G|N|100|N|N||IRIX|N
Y|IRL|New Ireland Fund, Inc (The) Common Stock|N| |N|100|N||IRL|IRL|N
Y|IRM|Iron Mountain Incorporated (Delaware)Common Stock REIT|N| |N|100|N||IRM|IRM|N
Y|IRMD|iRadimed Corporation - Common Stock|Q|S|N|100|N|N||IRMD|N
Y|IROQ|IF Bancorp, Inc. - Common Stock|Q|S|N|100|N|N||IROQ|N
Y|IRR|Voya Natural Resources Equity Income Fund Common Shares of Beneficial Interest|N| |N|100|N||IRR|IRR|N
Y|IRS|IRSA Inversiones Y Representaciones S.A. Common Stock|N| |N|100|N||IRS|IRS|N
Y|IRT|Independence Realty Trust, Inc. Common Stock|A| |N|100|N||IRT|IRT|N
Y|IRTC|iRhythm Technologies, Inc. - Common Stock|Q|G|N|100|N|N||IRTC|N
Y|IRV|SPDR S&P International Materials Sector ETF|P| |Y|100|N||IRV|IRV|N
Y|IRWD|Ironwood Pharmaceuticals, Inc. - Class A Common Stock|Q|Q|N|100|N|N||IRWD|N
Y|IRY|SPDR S&P International Health Care Sector ETF|P| |Y|100|N||IRY|IRY|N
Y|ISBC|Investors Bancorp, Inc. - Common Stock|Q|Q|N|100|N|N||ISBC|N
Y|ISCA|International Speedway Corporation - Class A Common Stock|Q|Q|N|100|N|N||ISCA|N
Y|ISCF|iShares Edge MSCI Intl Size Factor ETF|P| |Y|100|N||ISCF|ISCF|N
Y|ISD|Prudential Short Duration High Yield Fund, Inc. Common Stock|N| |N|100|N||ISD|ISD|N
Y|ISDR|Issuer Direct Corporation Common Stock|A| |N|100|N||ISDR|ISDR|N
Y|ISF|ING Group, N.V. Perp Hybrid Cap Secs (Netherlands)|N| |N|100|N||ISF|ISF|N
Y|ISG|ING Group, N.V. Perpetual Dent Secs 6.125%|N| |N|100|N||ISG|ISG|N
Y|ISHG|iShares S&P/Citigroup 1-3 Year International Treasury Bond Fund|Q|G|Y|100|N|N||ISHG|N
Y|ISIG|Insignia Systems, Inc. - Common Stock|Q|S|N|100|N|N||ISIG|N
Y|ISL|Aberdeen Israel Fund, Inc. (The) Common Stock|A| |N|100|N||ISL|ISL|N
Y|ISM|Navient Corporation - Medium Term Notes, Series A, CPI-Linked Notes due January 16, 2018|Q|Q|N|100|N|N||ISM|N
Y|ISMD|Inspire Small/Mid Cap Impact ETF|P| |Y|100|N||ISMD|ISMD|N
Y|ISNS|Image Sensing Systems, Inc. - Common Stock|Q|S|N|100|N|N||ISNS|N
Y|ISP|ING Groep NV 6.20% Perpetual Debt Securities (Netherlands)|N| |N|100|N||ISP|ISP|N
Y|ISR|IsoRay, Inc. Common Stock|A| |N|100|N||ISR|ISR|N
Y|ISRA|VanEck Vectors Israel ETF|P| |Y|100|N||ISRA|ISRA|N
Y|ISRG|Intuitive Surgical, Inc. - Common Stock|Q|Q|N|100|N|N||ISRG|N
Y|ISRL|Isramco, Inc. - Common Stock|Q|S|N|100|N|N||ISRL|N
Y|ISSC|Innovative Solutions and Support, Inc. - Common Stock|Q|Q|N|100|N|N||ISSC|N
Y|IST|SPDR S&P International Telecommunications Sector ETF|P| |Y|100|N||IST|IST|N
Y|ISTB|iShares Core 1-5 Year USD Bond ETF|P| |Y|100|N||ISTB|ISTB|N
Y|ISTR|Investar Holding Corporation - Common Stock|Q|G|N|100|N|N||ISTR|N
Y|ISZE|iShares Edge MSCI Intl Size Factor ETF|P| |Y|100|N||ISZE|ISZE|N
Y|IT|Gartner, Inc. Common Stock|N| |N|100|N||IT|IT|N
Y|ITA|iShares U.S. Aerospace & Defense ETF|P| |Y|100|N||ITA|ITA|N
Y|ITB|iShares U.S. Home Construction ETF|P| |Y|100|N||ITB|ITB|N
Y|ITCB|Itau CorpBanca American Depositary Shares (each representing 1,500 shares of Common Stock, no par value)|N| |N|100|N||ITCB|ITCB|N
Y|ITCI|Intra-Cellular Therapies Inc. - Common Stock|Q|Q|N|100|N|N||ITCI|N
Y|ITE|SPDR Bloomberg Barclays Intermediate Term Treasury ETF|P| |Y|100|N||ITE|ITE|N
Y|ITEK|Inotek Pharmaceuticals Corporation - Common Stock|Q|G|N|100|N|N||ITEK|N
Y|ITEQ|BlueStar TA-BIGITech Israel Technology ETF|Q|G|Y|100|N|N||ITEQ|N
Y|ITG|Investment Technology Group, Inc. Common Stock|N| |N|100|N||ITG|ITG|N
Y|ITGR|Integer Holdings Corporation Common Stock|N| |N|100|N||ITGR|ITGR|N
Y|ITI|Iteris, Inc. - Common Stock|Q|S|N|100|N|N||ITI|N
Y|ITIC|Investors Title Company - Common Stock|Q|Q|N|100|N|N||ITIC|N
Y|ITM|VanEck Vectors AMT-Free Intermediate Municipal Index ETF|P| |Y|100|N||ITM|ITM|N
Y|ITML|VanEck Vectors AMT-Free 12-17 Year Municipal Index ETF |Z| |Y|100|N||ITML|ITML|N
Y|ITMS|VanEck Vectors AMT-Free 6-8 Year Municipal Index ETF|Z| |Y|100|N||ITMS|ITMS|N
Y|ITOT|iShares Core S&P Total U.S. Stock Market ETF|P| |Y|100|N||ITOT|ITOT|N
Y|ITR|SPDR Bloomberg Barclays Intermediate Term Corporate Bond ETF (based on Barclays Capital Intermediate U.S. Corporate Index symbol LD06TRUU|P| |Y|100|N||ITR|ITR|N
Y|ITRI|Itron, Inc. - Common Stock|Q|Q|N|100|N|N||ITRI|N
Y|ITRN|Ituran Location and Control Ltd. - Ordinary Shares|Q|Q|N|100|N|N||ITRN|N
Y|ITT|ITT Inc. Common Stock |N| |N|100|N||ITT|ITT|N
Y|ITUB|Itau Unibanco Banco Holding SA American Depositary Shares (Each repstg 500 Preferred shares)|N| |N|100|N||ITUB|ITUB|N
Y|ITUS|ITUS Corporation - Common Stock|Q|S|N|100|N|N||ITUS|N
Y|ITW|Illinois Tool Works Inc. Common Stock|N| |N|100|N||ITW|ITW|N
Y|IUSB|iShares Core Total USD Bond Market ETF|P| |Y|100|N||IUSB|IUSB|N
Y|IUSG|iShares Core S&P U.S. Growth ETF|P| |Y|100|N||IUSG|IUSG|N
Y|IUSV|iShares Core S&P U.S. Value ETF|P| |Y|100|N||IUSV|IUSV|N
Y|IVAC|Intevac, Inc. - Common Stock|Q|Q|N|100|N|N||IVAC|N
Y|IVAL|ValueShares International Quantitative Value ETF|Z| |Y|100|N||IVAL|IVAL|N
Y|IVC|Invacare Corporation Common Stock|N| |N|100|N||IVC|IVC|N
Y|IVE|iShares S&P 500 Value ETF|P| |Y|100|N||IVE|IVE|N
Y|IVENC|Ivy NextShares - Ivy Energy NextShares|Q|G|N|100|N|N||IVENC|Y
Y|IVFGC|Ivy NextShares - Ivy Focused Growth NextShares|Q|G|N|100|N|N||IVFGC|Y
Y|IVFVC|Ivy NextShares - Ivy Focused Value NextShares|Q|G|N|100|N|N||IVFVC|Y
Y|IVH|Ivy High Income Opportunities Fund Common Shares of Beneficial Interest|N| |N|100|N||IVH|IVH|N
Y|IVLU|iShares Edge MSCI Intl Value Factor ETF|P| |Y|100|N||IVLU|IVLU|N
Y|IVOG|Vanguard S&P Mid-Cap 400 Growth ETF|P| |Y|100|N||IVOG|IVOG|N
Y|IVOO|Vanguard S&P Mid-Cap 400 ETF|P| |Y|100|N||IVOO|IVOO|N
Y|IVOP|iPath Inverse S&P 500 VIX Short Term Futures|P| |N|100|N||IVOP|IVOP|N
Y|IVOV|Vanguard S&P Mid-Cap 400 Value ETF|P| |Y|100|N||IVOV|IVOV|N
Y|IVR|INVESCO MORTGAGE CAPITAL INC Common Stock|N| |N|100|N||IVR|IVR|N
Y|IVR$A|Invesco Mortgage Capital Inc. Pfd Ser A|N| |N|100|N||IVRpA|IVR-A|N
Y|IVR$B|Invesco Mortgage Capital Inc. Preferred Series B Cum Fxd to Fltg|N| |N|100|N||IVRpB|IVR-B|N
Y|IVTY|Invuity, Inc. - Common Stock|Q|G|N|100|N|N||IVTY|N
Y|IVV|iShares Core S&P 500 ETF|P| |Y|100|N||IVV|IVV|N
Y|IVW|iShares S&P 500 Growth ETF|P| |Y|100|N||IVW|IVW|N
Y|IVZ|Invesco Ltd Common Stock|N| |N|100|N||IVZ|IVZ|N
Y|IWB|iShares Russell 1000 ETF|P| |Y|100|N||IWB|IWB|N
Y|IWC|iShares Microcap ETF|P| |Y|100|N||IWC|IWC|N
Y|IWD|iShares Russell 1000 Value ETF|P| |Y|100|N||IWD|IWD|N
Y|IWF|iShares Russell 1000 Growth ETF|P| |Y|100|N||IWF|IWF|N
Y|IWL|iShares Russell Top 200 ETF|P| |Y|100|N||IWL|IWL|N
Y|IWM|iShares Russell 2000 ETF|P| |Y|100|N||IWM|IWM|N
Y|IWN|iShares Russell 2000 Value ETF|P| |Y|100|N||IWN|IWN|N
Y|IWO|iShares Russell 2000 Growth ETF|P| |Y|100|N||IWO|IWO|N
Y|IWP|iShares Russell Midcap Growth ETF|P| |Y|100|N||IWP|IWP|N
Y|IWR|iShares Russell Mid-Cap ETF|P| |Y|100|N||IWR|IWR|N
Y|IWS|iShares Russell Mid-cap Value ETF|P| |Y|100|N||IWS|IWS|N
Y|IWV|iShares Russell 3000 ETF|P| |Y|100|N||IWV|IWV|N
Y|IWX|iShares Russell Top 200 Value ETF|P| |Y|100|N||IWX|IWX|N
Y|IWY|iShares Russell Top 200 Growth ETF|P| |Y|100|N||IWY|IWY|N
Y|IX|Orix Corp Ads Common Stock|N| |N|100|N||IX|IX|N
Y|IXC|iShares Global Energy ETF|P| |Y|100|N||IXC|IXC|N
Y|IXG|iShares Global Financial ETF|P| |Y|100|N||IXG|IXG|N
Y|IXJ|iShares Global Healthcare ETF|P| |Y|100|N||IXJ|IXJ|N
Y|IXN|iShares Global Tech ETF|P| |Y|100|N||IXN|IXN|N
Y|IXP|iShares Global Telecom ETF|P| |Y|100|N||IXP|IXP|N
Y|IXUS|iShares Core MSCI Total International Stock ETF|Q|G|Y|100|N|N||IXUS|N
Y|IXYS|IXYS Corporation - Common Stock|Q|Q|N|100|N|N||IXYS|N
Y|IYC|iShares U.S. Consumer Services ETF|P| |Y|100|N||IYC|IYC|N
Y|IYE|iShares U.S. Energy ETF|P| |Y|100|N||IYE|IYE|N
Y|IYF|iShares U.S. Financial ETF|P| |Y|100|N||IYF|IYF|N
Y|IYG|iShares U.S. Financial Services ETF|P| |Y|100|N||IYG|IYG|N
Y|IYH|iShares U.S. Healthcare ETF|P| |Y|100|N||IYH|IYH|N
Y|IYJ|iShares U.S. Industrials ETF|P| |Y|100|N||IYJ|IYJ|N
Y|IYK|iShares U.S. Consumer Goods ETF|P| |Y|100|N||IYK|IYK|N
Y|IYLD|iShares Morningstar Multi-Asset Income ETF|Z| |Y|100|N||IYLD|IYLD|N
Y|IYM|iShares U.S. Basic Materials ETF|P| |Y|100|N||IYM|IYM|N
Y|IYR|iShares U.S. Real Estate ETF|P| |Y|100|N||IYR|IYR|N
Y|IYT|iShares Transportation AverageETF|P| |Y|100|N||IYT|IYT|N
Y|IYW|iShares U.S. Technology ETF|P| |Y|100|N||IYW|IYW|N
Y|IYY|iShares Dow Jones U.S. ETF|P| |Y|100|N||IYY|IYY|N
Y|IYZ|iShares U.S. Telecommunications ETF|P| |Y|100|N||IYZ|IYZ|N
Y|IZEA|IZEA Inc. - Common Stock|Q|S|N|100|N|N||IZEA|N
Y|JACK|Jack In The Box Inc. - Common Stock|Q|Q|N|100|N|N||JACK|N
Y|JAG|Jagged Peak Energy Inc. Common Stock|N| |N|100|N||JAG|JAG|N
Y|JAGX|Jaguar Animal Health, Inc. - Common Stock|Q|S|N|100|N|D||JAGX|N
Y|JAKK|JAKKS Pacific, Inc. - Common Stock|Q|Q|N|100|N|N||JAKK|N
Y|JASN|Jason Industries, Inc. - Common Stock|Q|S|N|100|N|N||JASN|N
Y|JASNW|Jason Industries, Inc. - Warrant|Q|S|N|100|N|N||JASNW|N
Y|JASO|JA Solar Holdings, Co., Ltd. - American depositary shares, each representing five ordinary shares|Q|Q|N|100|N|N||JASO|N
Y|JAX|J. Alexander's Holdings, Inc. Common Stock|N| |N|100|N||JAX|JAX|N
Y|JAZZ|Jazz Pharmaceuticals plc - Ordinary Shares|Q|Q|N|100|N|N||JAZZ|N
Y|JBHT|J.B. Hunt Transport Services, Inc. - Common Stock|Q|Q|N|100|N|N||JBHT|N
Y|JBK|Lehman ABS 3.50 3.50% Adjustable Corp Backed Tr Certs GS Cap I|N| |N|100|N||JBK|JBK|N
Y|JBL|Jabil Inc. Common Stock|N| |N|100|N||JBL|JBL|N
Y|JBLU|JetBlue Airways Corporation - Common Stock|Q|Q|N|100|N|N||JBLU|N
Y|JBN|Select Asset Inc. Select Asset Inc. on behalf of Corporate Backed Callable Trust Certificates, J.C. Penney Debenture Backed Series 2007-1 Trust|N| |N|100|N||JBN|JBN|N
Y|JBR|Select Asset Inc. Corporate Backed Callable Trust Certificates, J.C. Penney Debenture-Backed Series 2006-1, Class A-1|N| |N|100|N||JBR|JBR|N
Y|JBSS|John B. Sanfilippo & Son, Inc. - Common Stock|Q|Q|N|100|N|N||JBSS|N
Y|JBT|John Bean Technologies Corporation Common Stock|N| |N|100|N||JBT|JBT|N
Y|JCAP|Jernigan Capital, Inc. Common Stock|N| |N|100|N||JCAP|JCAP|N
Y|JCE|Nuveen Core Equity Alpha Fund Nuveen Core Equity Alpha Fund Common Shares of Beneficial Interest|N| |N|100|N||JCE|JCE|N
Y|JCI|Johnson Controls International plc Ordinary Share|N| |N|100|N||JCI|JCI|N
Y|JCO|Nuveen Credit Opportunities 2022 Target Term Fund Common Shares of Beneficial Interest|N| |N|100|N||JCO|JCO|N
Y|JCOM|j2 Global, Inc. - Common Stock|Q|Q|N|100|N|N||JCOM|N
Y|JCP|J.C. Penney Company, Inc. Holding Company Common Stock|N| |N|100|N||JCP|JCP|N
Y|JCS|Communications Systems, Inc. - Common Stock|Q|G|N|100|N|N||JCS|N
Y|JCTCF|Jewett-Cameron Trading Company - Common Shares|Q|S|N|100|N|N||JCTCF|N
Y|JD|JD.com, Inc. - American Depositary Shares|Q|Q|N|100|N|N||JD|N
Y|JDD|Nuveen Diversified Dividend and Income Fund Shares of Beneficial Interest|N| |N|100|N||JDD|JDD|N
Y|JDST|Direxion Daily Junior Gold Miners Index Bear 3X Shares|P| |Y|100|N||JDST|JDST|N
Y|JE|Just Energy Group, Inc. Ordinary Shares (Canada)|N| |N|100|N||JE|JE|N
Y|JE$A|Just Energy Group, Inc. 8.50% Series A Fixed-to-Floating Rate Cumulative Redeemable Perpetual Preferred Shares|N| |N|100|N||JEpA|JE-A|N
Y|JEC|Jacobs Engineering Group Inc. Common Stock|N| |N|100|N||JEC|JEC|N
Y|JELD|JELD-WEN Holding, Inc. Common Stock|N| |N|100|N||JELD|JELD|N
Y|JEM|iPath GEMS Index ETN|P| |N|100|N||JEM|JEM|N
Y|JEQ|Aberdeen Japan Equity Fund, Inc.  Common Stock|N| |N|100|N||JEQ|JEQ|N
Y|JETS|U.S. Global Jets ETF|P| |Y|100|N||JETS|JETS|N
Y|JFC|JPMorgan China Region  Fund, Inc. Common Stock|N| |N|100|N||JFC|JFC|N
Y|JFR|Nuveen Floating Rate Income Fund Common Stock|N| |N|100|N||JFR|JFR|N
Y|JGH|Nuveen Global High Income Fund Common Shares of Beneficial Interest|N| |N|100|N||JGH|JGH|N
Y|JHA|Nuveen High Income December 2018 Target Term Fund|N| |N|100|N||JHA|JHA|N
Y|JHB|Nuveen High Income November 2021 Target Term Fund Nuveen High Income November 2021 Target Term Fund|N| |N|100|N||JHB|JHB|N
Y|JHD|Nuveen High Income December 2019 Target Term Fund Common Shares of Beneficial Interest|N| |N|100|N||JHD|JHD|N
Y|JHDG|WisdomTree Japan Hedged Quality Dividend Growth Fund|P| |Y|100|N||JHDG|JHDG|N
Y|JHG|Janus Henderson Group plc Ordinary Shares|N| |N|100|N||JHG|JHG|N
Y|JHI|John Hancock Investors Trust Common Stock|N| |N|100|N||JHI|JHI|N
Y|JHMA|John Hancock Multifactor Materials ETF|P| |Y|100|N||JHMA|JHMA|N
Y|JHMC|John Hancock Multifactor Consumer Discretionary ETF|P| |Y|100|N||JHMC|JHMC|N
Y|JHMD|John Hancock Exchange-Traded Fund Trust John Hancock Multifactor Developed International ETF|P| |Y|100|N||JHMD|JHMD|N
Y|JHME|John Hancock Multifactor Energy ETF|P| |Y|100|N||JHME|JHME|N
Y|JHMF|John Hancock Multifactor Financials ETF|P| |Y|100|N||JHMF|JHMF|N
Y|JHMH|John Hancock Multifactor Healthcare ETF|P| |Y|100|N||JHMH|JHMH|N
Y|JHMI|John Hancock Multifactor Industrials ETF|P| |Y|100|N||JHMI|JHMI|N
Y|JHML|John Hancock Multifactor Large Cap ETF|P| |Y|100|N||JHML|JHML|N
Y|JHMM|John Hancock Multifactor Mid Cap ETF|P| |Y|100|N||JHMM|JHMM|N
Y|JHMS|John Hancock Multifactor Consumer Staples ETF|P| |Y|100|N||JHMS|JHMS|N
Y|JHMT|John Hancock Multifactor Technology ETF|P| |Y|100|N||JHMT|JHMT|N
Y|JHMU|John Hancock Multifactor Utilities ETF|P| |Y|100|N||JHMU|JHMU|N
Y|JHS|John Hancock Income Securities Trust Common Stock|N| |N|100|N||JHS|JHS|N
Y|JHX|James Hardie Industries plc American Depositary Shares (Ireland)|N| |N|100|N||JHX|JHX|N
Y|JHY|Nuveen High Income 2020 Target Term Fund Common Shares of Beneficial Interest|N| |N|100|N||JHY|JHY|N
Y|JILL|J. Jill, Inc. Common Stock|N| |N|100|N||JILL|JILL|N
Y|JJA|iPath Bloomberg Agriculture Total Return Sub-Index ETN|P| |N|100|N||JJA|JJA|N
Y|JJC|iPath Bloomberg Copper Subindex Total Return Sub-Index ETN|P| |N|100|N||JJC|JJC|N
Y|JJE|iPath Bloomberg Energy Total Return Sub-Index ETN|P| |N|100|N||JJE|JJE|N
Y|JJG|iPath Bloomberg Grains Total Return Sub-Index ETN|P| |N|100|N||JJG|JJG|N
Y|JJM|iPath Bloomberg Industrial Metals Total Return Sub-Index ETN|P| |N|100|N||JJM|JJM|N
Y|JJN|iPath Bloomberg Nickel Subindex Total Return ETN|P| |N|100|N||JJN|JJN|N
Y|JJP|iPath Bloomberg Precious Metals Subindex Total Return SM Index ETN|P| |N|100|N||JJP|JJP|N
Y|JJS|iPath Bloomberg Softs Subindex Total Return SM Index ETN|P| |N|100|N||JJS|JJS|N
Y|JJSF|J & J Snack Foods Corp. - Common Stock|Q|Q|N|100|N|N||JJSF|N
Y|JJT|iPath Bloomberg Tin Subindex Total Return SM ETN|P| |N|100|N||JJT|JJT|N
Y|JJU|iPath Bloomberg Aluminum Subindex Total Return SM IndexETN|P| |N|100|N||JJU|JJU|N
Y|JKD|iShares Morningstar Large-Cap ETF|P| |Y|100|N||JKD|JKD|N
Y|JKE|iShares Morningstar Large-Cap Growth ETF|P| |Y|100|N||JKE|JKE|N
Y|JKF|iShares Morningstar Large-Cap  Value ETF|P| |Y|100|N||JKF|JKF|N
Y|JKG|iShares Morningstar Mid-Cap ETF|P| |Y|100|N||JKG|JKG|N
Y|JKH|iShares Morningstar Mid-Cap Growth ETF|P| |Y|100|N||JKH|JKH|N
Y|JKHY|Jack Henry & Associates, Inc. - Common Stock|Q|Q|N|100|N|N||JKHY|N
Y|JKI|iShares Morningstar Mid-Cap ETF|Q|G|Y|100|N|N||JKI|N
Y|JKJ|iShares Morningstar Small-Cap ETF|P| |Y|100|N||JKJ|JKJ|N
Y|JKK|iShares Morningstar Small-Cap Growth ETF|P| |Y|100|N||JKK|JKK|N
Y|JKL|iShares Morningstar Small-Cap Value ETFnd|P| |Y|100|N||JKL|JKL|N
Y|JKS|JinkoSolar Holding Company Limited American Depositary Shares (each representing 4 Common Shares)|N| |N|100|N||JKS|JKS|N
Y|JLL|Jones Lang LaSalle Incorporated Common Stock|N| |N|100|N||JLL|JLL|N
Y|JLS|Nuveen Mortgage Opportunity Term Fund Nuveen Mortgage Opportunity Term Fund|N| |N|100|N||JLS|JLS|N
Y|JMBA|Jamba, Inc. - Common Stock|Q|G|N|100|N|E||JMBA|N
Y|JMEI|Jumei International Holding Limited American Depositary Shares, each representing one Class A ordinary share|N| |N|100|N||JMEI|JMEI|N
Y|JMF|Nuveen Energy MLP Total Return Fund Common Shares of Beneficial Interest|N| |N|100|N||JMF|JMF|N
Y|JMLP|Nuveen All Cap Energy MLP Opportunities Fund Common Shares of Beneficial Interest|N| |N|100|N||JMLP|JMLP|N
Y|JMM|Nuveen Multi-Market Income Fund (MA)|N| |N|100|N||JMM|JMM|N
Y|JMP|JMP Group LLC Common Shares|N| |N|100|N||JMP|JMP|N
Y|JMPB|JMP Group Inc 8.00% Senior Notes due 2023|N| |N|100|N||JMPB|JMPB|N
Y|JMPC|JMP Group Inc 7.25% Senior Notes due 2021|N| |N|100|N||JMPC|JMPC|N
Y|JMT|Nuveen Mortgage Opportunity Term Fund 2 Common Shares of Beneficial Interest|N| |N|100|N||JMT|JMT|N
Y|JMU|JMU Limited - ADS|Q|G|N|100|N|N||JMU|N
Y|JNCE|Jounce Therapeutics, Inc. - Common Stock|Q|Q|N|100|N|N||JNCE|N
Y|JNJ|Johnson & Johnson Common Stock|N| |N|100|N||JNJ|JNJ|N
Y|JNK|SPDR Bloomberg Barclays High Yield Bond ETF|P| |Y|100|N||JNK|JNK|N
Y|JNP|Juniper Pharmaceuticals, Inc. - Common Stock|Q|Q|N|100|N|N||JNP|N
Y|JNPR|Juniper Networks, Inc. Common Stock|N| |N|100|N||JNPR|JNPR|N
Y|JNUG|Direxion Daily Junior Gold Miners Index Bull 3X Shares|P| |Y|100|N||JNUG|JNUG|N
Y|JO|iPath Bloomberg Coffee Subindex Total Return SM Index ETN|P| |N|100|N||JO|JO|N
Y|JOB|GEE Group Inc. Common Stock|A| |N|100|N||JOB|JOB|N
Y|JOBS|51job, Inc. - American Depositary Shares, each representing two common shares|Q|Q|N|100|N|N||JOBS|N
Y|JOE|St. Joe Company (The) Common Stock|N| |N|100|N||JOE|JOE|N
Y|JOF|Japan Smaller Capitalization Fund Inc Common Stock|N| |N|100|N||JOF|JOF|N
Y|JONE|Jones Energy, Inc. Class A Common Stock|N| |N|100|N||JONE|JONE|N
Y|JOUT|Johnson Outdoors Inc. - Class A Common Stock|Q|Q|N|100|N|N||JOUT|N
Y|JP|Jupai Holdings Limited American Depositary Shares, each representing six ordinary shares|N| |N|100|N||JP|JP|N
Y|JPC|Nuveen  Preferred Income Opportunities Fund|N| |N|100|N||JPC|JPC|N
Y|JPEH|JPMorgan Diversified Return Europe Currency Hedged ETF|P| |Y|100|N||JPEH|JPEH|N
Y|JPEM|JPMorgan Diversified Return Emerging Markets Equity ETF|P| |Y|100|N||JPEM|JPEM|N
Y|JPEU|JPMorgan Diversified Return Europe Equity ETF|P| |Y|100|N||JPEU|JPEU|N
Y|JPGB|JPMorgan Global Bond Opportunities ETF|Z| |Y|100|N||JPGB|JPGB|N
Y|JPGE|JPMorgan Diversified Return Global Equity ETF|P| |Y|100|N||JPGE|JPGE|N
Y|JPHF|J P Morgan Chase & Co ETF|P| |Y|100|N||JPHF|JPHF|N
Y|JPHY|JPMorgan Disciplined HY ETF|Z| |Y|100|N||JPHY|JPHY|N
Y|JPI|Nuveen Preferred and Income Term Fund Common Shares of Beneficial Interest|N| |N|100|N||JPI|JPI|N
Y|JPIH|JPMorgan Diversified Return International Currency Hedged ETF|P| |Y|100|N||JPIH|JPIH|N
Y|JPIN|JPMorgan Diversified Return International Equity ETF|P| |Y|100|N||JPIN|JPIN|N
Y|JPM|JP Morgan Chase & Co. Common Stock|N| |N|100|N||JPM|JPM|N
Y|JPM$A|J P Morgan Chase & Co Depositary Shs Repstg 1/400 Pfd Ser P|N| |N|100|N||JPMpA|JPM-A|N
Y|JPM$B|JP Morgan Chase & Co Depositary Shares Representing 1/400th Preferred Series T|N| |N|100|N||JPMpB|JPM-B|N
Y|JPM$D|JPMorgan Chase Bank N A London Branch Depositary Shs Repstg 1/400th Pfd Ser O|N| |N|100|N||JPMpD|JPM-D|N
Y|JPM$E|J P Morgan Chase & Co Depository Shares Representing 1/400th Int Perp Pfd Ser W|N| |N|100|N||JPMpE|JPM-E|N
Y|JPM$F|J P Morgan Chase & Co Depositary Shares, each representing 1/400th interest in a share of 6.125% Non-Cumulative Preferred Stock, Series Y|N| |N|100|N||JPMpF|JPM-F|N
Y|JPM$G|J P Morgan Chase & Co Depositary Shares, each representing a 1/400th interest in a share of 6.10% Non-Cumulative Preferred Stock, Series AA|N| |N|100|N||JPMpG|JPM-G|N
Y|JPM$H|J P Morgan Chase & Co Depositary Shares, each representing a 1/400th interest in a share of 6.15% Non-Cumulative Preferred Stock, Series BB|N| |N|100|N||JPMpH|JPM-H|N
Y|JPM.W|J P Morgan Chase & Co Warrant expiring October 28, 2018|N| |N|100|N||JPM/WS|JPM+|N
Y|JPME|JPMorgan Diversified Return U.S. Mid Cap Equity ETF|P| |Y|100|N||JPME|JPME|N
Y|JPMV|iShares Edge MSCI Min Vol Japan ETF|P| |Y|100|N||JPMV|JPMV|N
Y|JPN|Deutsche X-trackers Japan JPX-Nikkei 400 Equity ETF|P| |Y|100|N||JPN|JPN|N
Y|JPNL|Direxion Daily Japan Bull 3X ETF|P| |Y|100|N||JPNL|JPNL|N
Y|JPS|Nuveen Preferred Securities Income Fund 2 Shares of Beneficial Interest|N| |N|100|N||JPS|JPS|N
Y|JPSE|JPMorgan Diversified Return U.S. Small Cap Equity ETF|P| |Y|100|N||JPSE|JPSE|N
Y|JPST|JPMorgan Ultra-Short Income ETF|Z| |Y|100|N||JPST|JPST|N
Y|JPT|Nuveen Preferred and Income 2022 Term Fund Common Shares of Beneficial Interest|N| |N|100|N||JPT|JPT|N
Y|JPUS|JPMorgan Diversified Return U.S. Equity ETF|P| |Y|100|N||JPUS|JPUS|N
Y|JPXN|iShares JPX-Nikkei 400 ETF|P| |Y|100|N||JPXN|JPXN|N
Y|JQC|Nuveen Credit Strategies Income Fund Shares of Beneficial Interest|N| |N|100|N||JQC|JQC|N
Y|JRI|Nuveen Real Asset Income and Growth Fund Common Shares of Beneficial Interest|N| |N|100|N||JRI|JRI|N
Y|JRJC|China Finance Online Co. Limited - American Depositary Shares representing 5 ordinary shares|Q|Q|N|100|N|N||JRJC|N
Y|JRJR|JRjr33, Inc. Common Stock|A| |N|100|N||JRJR|JRJR|N
